{
  "schema": "agent-safe-bible.passage.v1",
  "ref": "John 3:16",
  "usfm": "JHN 3:16",
  "book": "John",
  "chapter": 3,
  "verse": 16,
  "translation": "KJV",
  "text": "For God so loved the world, that he gave his only begotten Son, that whosoever believeth in him should not perish, but have everlasting life.",
  "license": "public-domain",
  "kind": "quotation",
  "source": "KJV 1769 public domain"
}
