{
  "schema": "agent-safe-bible.passage.v1",
  "ref": "John 3:16",
  "usfm": "JHN 3:16",
  "book": "John",
  "chapter": 3,
  "verse": 16,
  "translation": "WEB",
  "text": "For God so loved the world, that he gave his only born Son, that whoever believes in him should not perish, but have eternal life.",
  "license": "public-domain",
  "kind": "quotation",
  "source": "https://bible.helloao.org/api/ENGWEBP/complete.simple.json"
}
